Description,Type
"In May 2015, threat actors compromised French television network TV5 Monde, disrupting broadcasts for three hours and gaining access to the network’s social media accounts. A group allegedly allied with the self-declared Islamic State and calling itself the Cyber Caliphate initially claimed responsibility for the incident. However, later investigations revealed links to Russian hacking group APT 28.

TV5 Monde is an example of a “false flag” operation, whereby a threat actor tries to mask its identity by leaving clues or attributes that would cause the victim to pin the blame on someone else. The threat actors behind TV5 Monde were successful enough in their flagging to lead French authorities to believe the incident was a terrorist attack. It is unknown why Russia would have conducted a false flag operation in France disguising itself as the Islamic State. 

In October 2018, the UK government announced that this incident was the work of Russian military intelligence.",Defacement
"A threat actor used a tool called Bookworm to compromise government agencies in Thailand, for the purpose of espionage.",Espionage
"The government of Uganda, under the Yoweri Museveni administration, used FinFisher, an advanced spyware developed by Gamma Group, to quell political unrest that resulted from allegations of corruption and police brutality after the 2011 general election.",Espionage
"This threat actor targets U.S. government entities, the defense industrial base, law firms, information technology companies, resource extraction companies, and nongovernmental organizations. Ethical hacking group Intrusion Truth doxed three members of this threat actor: two hackers plus the head of four Chinese companies who is also believed to be an officer of the Chinese Ministry of State Security (MSS). The hackers are believed to be operating as contractors for the Jinan bureau of the Chinese MSS, where they carry out on-demand hacking operations.",Espionage
"This threat actor targets defense contractors and academic institutions in Israel, European government agencies, and civil society actors. It seeks out material related to diplomacy, defense, security, journalism, and human rights for espionage purposes.",Espionage
A threat actor compromised the networks of Australia's Bureau of Meteorology for espionage purposes.,Espionage
A threat actor compromised the networks of the Japan Pension Service and gained access to the pension records of over 1.25 million individuals.,Espionage
"In 2015, Moscow-based Kaspersky Lab published a report on the Equation Group, a threat actor active since 2001 [PDF]. It was responsible for infecting approximately five hundred systems in at least forty-two countries. The malware used by Equation Group had the ability to reprogram hard drives and then self-destruct, which made the operations effectively invisible and indestructible. Targeted systems ranged from the private to the public sector, from energy departments to military operations to media outlets.

The tools and scope of the Equation Group suggest that it is one of the most sophisticated threat actors operating in cyberspace. Many believe that Equation Group is a state-sponsored entity, such as the U.S. National Security Agency or a joint effort between it and its Five Eyes allies.",Espionage
A threat actor compromised a legacy unclassified network at the Department of Defense.,Espionage
"A threat actor compromised the networks of the U.S. Office of Personnel Management, exposing the data of at least 22.1 million people who have applied for a U.S. security clearance.",Espionage
"This threat actor uses spear-phishing techniques to compromise diplomatic targets in Southeast Asia, India, and the United States. It also seems to have targeted the APT 30.",Espionage
A threat actor compromised an unclassified network used by the U.S. Joint Chiefs of Staff for espionage purposes.,Espionage
"A threat actor compromised the network of United Airlines for espionage purposes, gaining access to flight manifests.",Espionage
A threat actor attempted to compromise Ukrainian officials in government and law enforcement for espionage purposes. Ukrainian intelligence claims this was done in support of Russian-backed military activities in eastern Ukraine.,Espionage
A threat actor compromised networks associated with Seoul's subway system.,Espionage
"A threat actor launched a denial of service attack against GitHub to prevent access to internet content banned in China, such as the New York Times. The incident was the first in which threat actors, believed to be associated with the government of China, used a tool dubbed the Great Cannon.",Denial of service
"A threat actor compromised the website of the Permanent Course of Arbitration for espionage purposes, intending to compromise visitors to the website.",Espionage
Threat actors compromised unclassified White House networks using access from compromised networks at the State Department.,Espionage
"A threat actor compromised government networks affiliated with members of the South Korean parliament. The threat actor also attempted to compromise the Foreign Ministry, Defense Ministry, and the Blue House.",Espionage
"This threat actor targets Japanese entities in the government, manufacturing, finance, space, education, food, and medical sectors for espionage purposes.",Espionage
"A threat actor attempted to compromise the networks of the Dutch Safety Board, the group charged with investigating the crash of Malaysia Airlines Flight 17, which crashed in Ukraine.",Espionage
A threat actor compromised the networks of several Saudi government ministries for the purposes of espionage and doxing.,Espionage
A threat actor compromised social media accounts of junior State Department staff to launch spear-phishing campaigns for espionage purposes.,Espionage
"This threat actor compromises government and military targets in Hong Kong, Japan, Taiwan, Vietnam, the Philippines, and Indonesia for espionage purposes.",Espionage
"Community Health Systems, a large hospital group in the United States, announced that its computer networks  were compromised, leading to the exfiltration of Social Security numbers and other personal information of approximately 4.5 million people to China.",Espionage
"This threat actor targets companies in the education, energy, construction, information technology, and pharmaceutical sectors for the purposes of espionage. It uses malware tailored to target industrial control systems.",Espionage
"This threat actor targets high-tech and manufacturing companies, primarily from Japan, for the purpose of acquiring trade secrets. In 2017, cybersecurity firms released evidence pointing to the threat actor expanding its targets to Russian and Tibetan interests.",Espionage
"A threat actor successfully compromises the networks of contractors for U.S. Transportation Command (TRANSCOM), a military command assigned with moving U.S. military personnel and assets around the world. ",Espionage
"This threat actor targets governments, militaries, and research organizations for espionage purposes. ",Espionage
"This threat actor targets militaries and governments interested in the South China Sea, including the U.S. defense industrial base.",Espionage
"Threat actors compromised the networks of Sony Pictures Entertainment, destroyed data, and publicly released employee emails. The United States attributed the incident to North Korea, which is believed to have staged the attack to prevent Sony from releasing the film The Interview, which depicts an assassination plot against North Korean leader Kim Jong-un.

The compromise of Sony Pictures was the first cyber incident to be formally condemned by a U.S. president. The incident also prompted the United States to sanction certain North Korean individuals and organizations, denying them access to U.S. financial institutions.

In September 2018, the U.S. Department of Justice announced criminal charges alleging that North Korean entities were responsible for this incident.",Doxing
"This threat actor compromises a range of actors of espionage purposes, namely government agencies in Asia and the West, circuit manufacturers, networking equipment manufacturers, internet companies, software vendors, journalists, nongovernmental organizations, law firms, telecommunication firms, venture capitalists, and academic institutions.",Espionage
"This threat actor is linked to espionage campaigns, high-profile doxing efforts, and disruptive incidents that compromised targets believed to be of interest to the Russian government.

Suspected to be behind the Democratic National Committee compromise, the 2015 compromise of networks of the German Bundestag, the 2015 TV5 Monde incident, the UK TV station incident, the hacking of a Ukrainian military mobile app, the compromise of the World Anti-Doping Agency, the compromise of numerous sports federations, the attempted compromise of Bellingcat, the Bad Rabbit incident, the targeting of European foreign ministries and defense agencies, the targeting of campaigns for the 2018 U.S. midterm elections, the targeting of the office of Senator Claire McCaskill, the targeting of the OPCW, and the compromise of U.S. Anti-Doping Agency, the Court of Arbitration for Sport, the Canadian Centre for Ethics in Sport, FIFA, Westinghouse, the targeting of U.S. political campaigns, advocacy groups, and political consultancies, the targeting of Azerbaijani government networks, and the penetration of an unnamed U.S. federal agency. ",Other
"This threat actor targets industrial control systems, using a tool called Black Energy, associated with electricity and power generation for espionage, denial of service, and data destruction purposes. Some believe that the threat actor is linked to the 2015 compromise of the Ukrainian electrical grid and a distributed denial of service prior to the Russian invasion of Georgia. 

In 2018, Germany’s domestic intelligence agency released a technical alert about this threat actor, and the United Kingdom attributed the actor to Russian military intelligence.

In May 2020, the NSA publicly accused the group of targeting email servers worldwide.",Espionage
"This threat actor targets private sector entities, law enforcement organizations, and militaries, primarily in East Asia, for espionage purposes.",Espionage
"This threat actor uses watering hole attacks and fake profiles to lure targets from the U.S. government for espionage purposes. Also believed to target scholars who study Iran, human rights organizations, and the media. At least one cybersecurity company claims that Behzah Mesri, who was indicted by the U.S. Department of Justice for compromising the networks of HBO, was a member of this threat actor group",Espionage
"This threat actor targets human rights groups, government entities, and companies in the pharmaceutical, medical, industrial, and information technology sectors.",Espionage
"This threat actor targets governments and private sector entities for espionage and sabotage purposes. It is believed to be responsible for compromising U.S. Navy computers at the Navy Marine Corps Intranet in San Diego, the U.S. energy company Calpine Corporation, Saudi Aramco, Pemex, Qatar Airways, and Korean Air (http://www.reuters.com/article/2014/12/02/us-cybersecurity-iran-idUSKCN…)",Espionage
A threat actor attempted to compromise email accounts in Ukraine for espionage purposes.,Espionage
This threat actor targets governments and diplomatic organizations for espionage purposes.,Espionage
Threat actors launched a denial of service attack and wiped data from the computer networks at the Sands Casino in Las Vegas.,Data destruction
"In May 2014, the U.S. Department of Justice indicted five members of the People’s Liberation Army (PLA) Unit 61398, a Chinese army unit dedicated to cyber espionage. According to the Department of Justice, Unit 61398 compromised U.S. corporate networks for trade information potentially useful to Chinese state-owned enterprises.

The PLA indictments were the most direct confrontation to date between Washington and Beijing regarding Chinese government sponsorship of hacking groups. It was the first time that the U.S. Department of Justice indicted state-sponsored actors, and was part of a broader effort by the United States to halt China’s cyber industrial espionage programs and define an international norm against cyber espionage for commercial gain.",Espionage
A threat actor compromised an unnamed steel mill by accessing the plant's business network and working its way into production networks and the systems controlling plant equipment. The compromise causes one of plant's furnaces to shut down.,Sabotage
"Su Bin, a Chinese national, pleaded guilty to hacking Boeing and other U.S. defense contractors for the purpose of passing confidential information to the People's Liberation Army.",Espionage
"This threat actor targets military, government entities, and telecommunications providers, primarily in Latin America, for the purpose of espionage.",Espionage
A threat actor compromised the networks of Canada's National Research Council and exfiltrated data for espionage purposes. The government of Canada confirmed that Chinese state-sponsored actors were responsible.,Espionage
"This threat actor targets organizations in Japan, Taiwan, and elsewhere in East Asia—including electronics manufacturers and telecommunications companies—for espionage purposes.",Espionage
The contractor responsible for security clearance at the U.S. Department of Homeland Security had their networks hacked and employee information was compromised.,Espionage
"This threat actor targets governments, diplomatic missions, private companies in the energy sector, and academics for espionage purposes.",Espionage
"Threat actor targeted pro-democracy activists by enticing them to download and install malware-laden Android apps, allowing the threat actors to remotely track and record conversations on compromised phones.",Espionage
"A threat actor, confirmed to be the French government, that targets governments, companies, media organizations, military contractors, and humanitarian organizations.",Espionage
A threat actor compromised Apple's iCloud service in China and intercepted user names and passwords of targeted iCloud users.,Espionage
This threat actor is focused on espionage and targets companies within the U.S. defense industrial base and Iranians who use anticensorship technology.,Espionage
A threat actor compromised the unclassified network of the State Department for espionage purposes.,Espionage
A threat actor compromised the networks of the U.S. Postal Service and gained access to employee data.,Espionage
"A threat actor, using a tool dubbed Regin, compromised telecommunications networks and collected information about how those networks operate to facilitate espionage on other targets such as governments, financial institutions, and academics.",Espionage
"This threat actor targets firms in the technology (communications, space, aerospace), research, defense, and government sectors in the United States for espionage purposes. The tools and infrastructure it uses overlap with PLA Unit 61398.",Espionage
Threat actors accessed weather network data,Espionage
"This threat actor targets multiple entities, primarily around India but also in the United States, the Middle East, and China.",Espionage
A threat actor compromised Finland’s Ministry of Foreign Affairs for espionage purposes. The threat actor specifically targeted communications between Finland and the European Union.,Espionage
"This threat actor targets South Korean think tanks, industry, nuclear power operators, and the Ministry of Unification for espionage purposes. Also responsible for launching a launching a spear-phishing campaign targeting UN officials, including those affiliated with the UN Security Council.",Espionage
"This threat actor targets prodemocratic activists and organizations in Hong Kong, European and international financial institutions, and a U.S.-based think tank.",Espionage
This threat actor uses phishing techniques to compromise the networks of foreign ministries of European countries for espionage purposes.,Espionage
"This threat actor targets government ministries and agencies in the West, Central Asia, East Africa, and the Middle East; Chechen extremist groups; Russian organized crime; and think tanks. It is suspected to be behind the 2015 compromise of unclassified networks at the White House, Department of State, Pentagon, and the Joint Chiefs of Staff. The threat actor includes all of the Dukes tool sets, including MiniDuke, CosmicDuke, OnionDuke, CozyDuke, SeaDuke, CloudDuke (aka MiniDionis), and HammerDuke (aka Hammertoss).",Espionage
A threat actor compromised an unclassified U.S. Navy computer network for espionage purposes.,Espionage
This threat actor targets computer networks associated with Tibetan and Uighur activists for espionage purposes.,Espionage
"This threat actor has been targeting the U.S. defense industrial base, telecommunications, computer hardware, government contractors, and aerospace firms since at least 2006. It was also seen targeting ""Umbrella revolution"" activists.",Espionage
"This threat actor targets government institutions, military contractors, maritime and shipbuilding groups, telecommunications operators, and others, primarily in Japan and South Korea.",Espionage
"This threat actor compromises high-tech sector companies, the U.S. defense industrial base, nongovernmental organizations, and state and federal government entities for espionage purposes. It is also suspected of being behind the breaches at Anthem, the U.S. Office of Personnel Management, and United Airlines.",Espionage
"This threat actor targets governments, diplomatic missions, academics, and energy and aerospace organizations for the purpose of espionage.",Espionage
"Threat actors compromised the networks of European Aeronautic Defense and Space Company (EADS) and ThyssenKrupp, defense contractors with offices in Germany.",Espionage
"U.S. cybersecurity firm Mandiant, later purchased by FireEye, released a report in February 2013 that exposed one of China’s cyber espionage units, Unit 61398. The group, which FireEye called APT 1, is a unit within China’s People’s Liberation Army (PLA) that has been linked to a wide range of cyber operations targeting U.S. private sector entities for espionage purposes. The comprehensive report detailed evidence connecting APT 1 and the PLA, offered insight into APT 1’s operational malware and methodologies, and provided timelines of the espionage it conducted.

FireEye termed Unit 61398 “APT 1” to indicate that the threat actor was an Advanced Persistent Threat, a type of operation in which the goal of the network intrusion is not only to gain access to a server or system, but also to retain ongoing access and engage in protracted cyber operations. The APT 1 report exposed the infrastructure of a cyber threat actor and gave both government and nongovernment organizations insight into the escalating nature of state-sponsored cyber operations.",Espionage
A threat actor compromised India's Defense Research and Development Organization for espionage purposes.,Espionage
This threat actor primarily compromises government entities and human rights activists in Eastern Europe and Central Asia for espionage purposes. It has also compromised private and public sector entities in the Middle East and in Western countries.,Espionage
"Threat actors compromised the computer networks of South Korean broadcasters and two banks, making them unresponsive.",Denial of service
This threat actor targets government and private sector entities interested in maritime issues in the South China Sea for espionage purposes,Espionage
Threat actors compromised various Australian government ministries for the purposes of espionage. Threat actors allegedly infiltrated blueprints of the Australian Security Intelligence Organization's new headquarters.,Espionage
"In 2012, threat actors wiped data from approximately thirty-five thousand computers belonging to Saudi Aramco, one of the world’s largest oil companies. Malware called Shamoon stole passwords, wiped data, and prevented computers from rebooting. Hackers calling themselves the ""Cutting Sword of Justice"" claimed responsibility for the incident, asserting they were retaliating against the al-Saud regime for what the group called widespread crimes against humanity. U.S. intelligence sources have attributed the attack to Iran. Less than two weeks after the Aramco incident, the Qatari gas giant RasGas was also knocked offline by suspected state-sponsored  attackers. 

The Saudi Aramco incident signaled Iran’s growing cyber capabilities and Tehran’s willingness to use them to promote its interests, particularly in its battle of influence in the Middle East with Saudi Arabia. At the time, some countries had the capability to remotely destroy computer data, but there were few publicly known instances of a country using them, and Iran may have been responding to a previous attack against the Iranian Oil Ministry and the National Iranian Oil Company that used a malware called Wiper.",Data destruction
"A threat actor, using a tool called Flame, targeted computers in the Middle East region; the most compromises were in Iran. This compromise gained widespread coverage due to the modular nature of the malware the threat actors used.",Data destruction
"This threat actor compromises engineering firms, government entities, and financial and academic institutions in the United States, Israel, Iran, and Pakistan",Espionage
"Threat actors compromised the networks of Nortel, a now-defunct telecommunications equipment provider, over an extended period of time for the purposes of espionage.",Espionage
"A threat actor used a tool called Gauss to target the accounts of several Lebanon-based banks, including BlomBank, ByblosBank, Credit Libanais.",Espionage
A threat actor attempted to jam BBC satellite feeds into Iran and launched a series of automated calls to flood the BBC London office. The incident occurred after the BBC announced a spike in viewership of its Persian TV service.,Denial of service
"This threat actor targets private sector companies in the defense, shipping, aeronautics, arms, and energy sectors, as well as nonprofits and financial firms.",Espionage
"Malware, believed to be linked to Lucky Cat, that facilitates cyber espionage on activists through spear phishing",Espionage
One of the threat actors responsible for the denial of service attacks against U.S in 2012–2013. Three individuals associated with the group—believed to be have been working on behalf of Iran’s Islamic Revolutionary Guard Corps—were indicted by the Justice Department in 2016.,Denial of service
"The websites of Bank of America, JPMorgan Chase, Wells Fargo, and other U.S. financial institutions suffered simultaneous outages due to a coordinated denial of service cyberattack in September 2012. Attackers flooded bank servers with junk traffic, preventing users from online banking. An Iranian group called Izz ad-Din al-Qassam Cyber Fighters initially claimed responsibility for the incident. At the time, the media reported that U.S. intelligence believed the denial of service was in response to U.S. imposed economic sanctions to counter Iran’s nuclear program. Seven Iranian individuals linked to the Islamic Revolutionary Guard Corps were eventually indicted by the U.S. Department of Justice in 2016 for their involvement in the incident. 

The denial of service attacks against U.S. banks is significant for two reasons. First, the size and scale of the attacks led the State Department to seek other countries’ assistance in taking down the compromised computers that were flooding the banks with junk traffic. Second, the attacks would indicate that Iran—if it was in fact using the attacks as retaliation for U.S. financial sanctions—was acting proportionally in its dispute with the United States.",Denial of service
A threat actor compromised Coca-Cola’s network coinciding with the company's attempted acquisition of China Huiyuan Juice Group.,Espionage
"A threat actor targets computer networks associated with Tibetan activists, as well as military research and development, aerospace, engineering, and shipping industries in India and Japan.",Espionage
A loosely organized collective of Syrian government–affiliated threat actors that has targeted a wide range of entities since 2011.,Other
Threat actors compromised the computer networks of the U.S. Chamber of Commerce,Espionage
"Dubbed “Ten Days of Rain,” this attack was a ten-day denial of service campaign that targeted websites associated with the South Korean government and U.S. military forces in South Korea.",Denial of service
"South Korean prosecutors allege that North Korean intelligence conducted a denial of service campaign against a South Korean bank, causing millions of customers to be unable to use the bank's credit cards and ATMs for more than a week.",Denial of service
A compromise at the computer network of Oak Ridge National Laboratory led to the exfiltration of approximately one gigabyte of data and the shutdown of the network.,Espionage
"A threat actor targeted government entities (primarily in the United States), defense contractors, think tanks, and companies in the advanced information technology and aerospace industries for espionage purposes using a tool called Shady RAT.",Espionage
A threat actor compromised the computer network of the Democratic Progressive Party (a political party in Taiwan) and exfiltrated data.,Espionage
