Description,Type
The suspected Russian hackers conducted a weeks-long attack on Austria’s foreign ministry.,Espionage
The suspected North Korean threat actor Konni Group attempted to trick employees of an unnamed U.S. government agency to install malware on their computers via a spear-phishing campaign.,Espionage
Responsible for attacking infrastructure that cyber criminals abroad were using to target Australians during the COVID-19 pandemic.,Data destruction
The Hamas-associated threat actor APT-C-23 targeted Israeli soldiers by pretending to be women looking for romantic partners. Duped soldiers were then enticed to download apps that contained spyware onto their phones.,Espionage
"Iranian hackers attacked high-end networking equipment with recently reported vulnerabilities that had not yet been patched, providing a “beachhead” for peer hacking groups.",Espionage
The Saudi Arabian government used flaws in the global Signaling System 7 (SS7) to track Saudis in the United States by sending requests through Saudi phone companies.,Espionage
"Hidden Cobra used a variety of malware tools to hack into and steal money from banks, cryptocurrency exchanges, and ATMs.",Financial Theft
"Responsible for gathering sensitive and private information relevant to Iran. In addition to stalking Iranian expats and dissidents, Pioneer Kitten has targeted North American and Israeli technology, government, defense, and healthcare organizations. Pioneer Kitten is unlikely to be an official part of the Iranian government, and is more likely contracted to act on its behalf.",Espionage
"The alleged Russian actors hacked Burisma, a Ukrainian gas company whose board Joe Biden’s son sat on. President Trump had previously pressed Ukraine to open an investigation into Biden and Burisma, which led to his impeachment.",Espionage
The Saudi hackers KINGDOM launched a phishing attack to attempt to trick  journalist Ben Hubbard into installing NSO Group’s Pegasus malware onto his phone. Hubbard does not recall clicking on the infected link sent to him via text message and it is unknown if his phone was infected.,Espionage
Hackers targeted two water pumps in Galilee and Mateh Yehuda. No real-world effects were reported as a result of the hacking operation. Israel's government stated that no data had been stolen.,Sabotage
The Syrian Electronic Army distributed numerous COVID-19–themed Android mobile apps to Arabic-speaking users.,Espionage
Responsible for using social engineering and lofty job postings to coax employees into downloading malware that ultimately stole classified data.,Espionage
"The Iranian threat actors targeted dozens of companies in the United States, Israel, Saudi Arabia, and elsewhere. They exploited VPNs for initial access and breached additional companies via supply chain attacks.",Espionage
"Hackers breached Poland’s War Studies University’s website and posted a fake letter from the university’s commander, urging Polish soldiers “to fight against the American occupation.”",Defacement
"Iranian hackers stole personal documents and two-factor authentication codes from SMS messages, recorded phones’ surroundings, and used Telegram phishing accounts to target Iranian expats and dissidents.",Espionage
"The Iranian state-backed hackers installed malware on the network of Bapco, Bahrain’s national oil producer. The malware, called Dustman, used a wiper functionality, but experts suspect this could have been meant to erase itself after being discovered.",Espionage
Performed highly targeted watering-hole attacks on visitors to Tibetan websites.,Other
"Hackers conducted an espionage campaign against Vatican City beginning in May 2020. In one instance, embedded malware was sent using the email of the Vatican Secretary of State. Hackers were likely trying to gain information on the Vatican’s negotiating position prior to high-level talks between the Catholic Church and Beijing in September 2020 regarding a provisional agreement concerning the appointment of Catholic bishops in China. ",Other
"The Chinese government–aligned APT Tonto Team used Bisonal malware for over ten years in various campaigns against entities in Japan, Russia, and South Korea.",Espionage
The Australian government launched cyberattacks disabling infrastructure used by foreign-based cybercriminals targeting Australians during the coronavirus pandemic.,Data destruction
"Responsible for targeting governments in Asia, particularly in Taiwan but also in Hong Kong and Japan. They used Taidoor malware to steal information from Taiwanese government agencies and official email accounts.",Espionage
"The Iranian hackers APT 33 targeted the U.S. electric grid with password-spraying attacks, likely in an attempt to gain access. They targeted only the IT side of networks so far and have not proven their ability to access physical systems.",Espionage
"Hackers impersonated recruiters from Collins Aerospace and General Dynamics to lure in employees with enticing job offers, subsequently tricking them into opening malicious files sent via LinkedIn’s private messaging app.",Espionage
Chinese hackers scanned networks in search of virtual private network (VPN) and email server vulnerabilities with the aim of exfiltrating data.,Espionage
"The China-linked Bronze Butler threat actor is suspected to have used a zero-day in Trend Micro antivirus to attack Mitsubishi Electric and steal data on thousands of employees. In May 2020, it was disclosed that the breach resulted in the theft of specifications for a hypersonic missile that Japan had been developing to protect disputed territory in the East China Sea.",Espionage
The Chinese hackers Storm Cloud performed highly targeted watering-hole attacks on visitors to a few Tibetan websites and tried to make them install fake versions of Adobe Flash.,Other
"Hackers conducted a combination of financially motivated and espionage-driven hacking operations against hundreds of companies, organizations, and research firms based in the United States and other countries, stealing terabytes of information.",Espionage
"Chinese government-aligned APT that used Bisonal malware for over ten years in various campaigns against entities in Japan, Russia, and South Korea.",Other
"Cyber actors affiliated with the Chinese government attempted to identify and illicitly obtain intellectual property and public health data related to vaccines, treatments, and testing from networks and personnel associated with COVID-19–related research.",Espionage
"Hackers exploited vulnerabilities in at least four Taiwanese tech companies that provided information technology services to the government using the Taidoor malware, allowing them far-reaching access to official systems and accounts since at least 2018.",Espionage
Conducted coronavirus-related phishing campaign against targets in the Mongolian government.,Other
"Dating back to 2018, hackers conducted espionage campaigns against air transportation and government agencies in Kuwait and Saudi Arabia.",Other
Iranian hackers scanned U.S. government and private networks for virtual private network (VPN) and cloud computing vulnerabilities with the aim of exfiltrating data.,Other
"An account belonging to Prince Mohammed bin Salman sent Jeff Bezos spyware masquerading as a video over WhatsApp, which allowed Saudi Arabia to surveil Bezos’ phone from May 2018 until February 2019. The attack could have been related to Bezos’ ownership of the Washington Post, whose columnist Jamal Khashoggi was allegedly killed on bin Salman’s orders.",Espionage
"Hackers sent phishing emails masquerading as Google web services to WHO employees, attempting to gain access to internal information.",Espionage
Believed to be responsible for conducting an espionage campaign against Vatican City and its subsidiary organization in China.,Espionage
"The Russian threat actor Turla compromised four Armenian websites, two belonging to the government and two closely related, to use in a strategic web compromise/watering-hole attack.",Espionage
"A group using tools similar to Chinese government–affiliated group Vicious Panda targeted high-profile companies in Central Asia and planting backdoors to gain access to corporate networks. The group is also believed to be behind cyberattacks in Belarus, Mongolia, and Russia.",Espionage
Hackers affiliated with the Lazarus Group targeted automated teller machines (ATMs) by manipulating transaction-processing software to initiate fraudulent cash-outs.,Financial Theft
The suspected Chinese threat actor Vicious Panda conducted a coronavirus-related phishing campaign against targets in the Mongolian government.,Espionage
Hackers used supply chain vulnerabilities to access German critical infrastructure companies’ information technology (IT) systems.,Espionage
"Responsible for disguising Zebrocy malware, which creates a persistent backdoor, as North Atlantic Treaty Organization (NATO) training materials. Azerbaijan, which cooperates with NATO, is a suspected target.",Espionage
"The Turkish hackers attacked at least thirty organizations across the Middle East and Europe, including Cypriot and Greek government email services and the Iraqi government’s national security advisor. Their methods include intercepting internet traffic to victim websites.",Espionage
Vietnamese hackers sent spear-phishing messages to the Wuhan government and China’s Ministry of Emergency Management.,Espionage
Believed to be responsible for conducting a hacking and information operations campaign in Eastern Europe. Hackers compromised websites and email accounts and used them to publish fabricated documents pushing anti–North Atlantic Treaty Organization (NATO) narratives. They then donned fake personas of local officials to promote the fabricated documents on social media.,Other
Pakistani government-aligned threat actor that has used fake coronavirus health information to phish targets.,Other
"Israel retaliated against Iran for targeting of Israeli water treatment and sewage facilities by launching a cyberattack against Iran’s Shahid Rajaee Port, disrupting its operations.",Sabotage
North Korean hackers used fake job postings from leading U.S. defense contractors on LinkedIn to install malicious data-gathering software when clicked.,Espionage
"The Russian hackers Hades (aka APT 28) targeted Ukraine with coronavirus-themed phishing emails. At the same time, viral disinformation about the virus spread in Ukraine, causing riots.",Espionage
"Hackers from Sandworm exploited a zero-day vulnerability in Exim mail transfer agent software, which runs on email servers around the world, granting them the ability to remotely execute commands on the compromised servers.",Espionage
Russian hackers used compromised credentials to install malware and ultimately steal files from unnamed U.S. government agency computers.,Espionage
"The Iranian state-backed hackers sent out sophisticated spear-phishing lures imitating Westat, a research services company, in hopes of compromising U.S. government employees and networks. They could have also intended to compromise actual Westat employees.",Espionage
"Using a new exploit named Aria-body, APT 30 attempted to compromise networks belonging to governments and state-owned companies in Australia and Southeast Asia.",Espionage
"Hackers targeted websites and email accounts in Latvia, Lithuania, and Poland to publish fabricated documents pushing anti–North Atlantic Treaty Organization (NATO) narratives consistent with Kremlin talking points.",Defacement
The Pakistani government–aligned threat actor APT 36 used a fake coronavirus health advisory to phish its targets and deliver a RAT.,Espionage
"China-linked Winnti Umbrella launched a ransomware attack against Taiwan’s state oil company, CPC Corporation, causing its website to go offline for one day.",Sabotage
"North Korean hackers launched a spear-phishing campaign that disguised malware as UN security alerts and interview requests. At least twenty-eight UN officials, eleven of whom represented six members of the UN Security Council, were targeted.",Espionage
The Japanese defense contractors Pasco and Kobe Steel disclosed security breaches that happened between 2015 and 2016 and in May 2018. Kobe steel supplies submarine parts to the Japan Self-Defense Forces and Pasco provides satellite data. Nikkei suspects that Bronze Butler could have been involved.,Espionage
Hackers believed by Australian officials to be operating on behalf of China targeted Australian government agencies and companies through a known exploit in Microsoft Sharepoint.,Espionage
"The Winnti Umbrella, a Chinese government-backed threat actor, installed malware on computer systems at two universities in Hong Kong during protests. Three other universities in Hong Kong could have been simultaneously targeted.",Espionage
"Iranian hackers sought to cripple computers that control water flow and wastewater treatment for two rural districts in Israel. Israeli officials reported that the attack was quickly detected and defeated, preventing harm to water supplies.",Sabotage
"Hackers targeted various entities involved in Taiwan-related issues with spear-phishing emails containing Taidoor, a remote-access trojan (RAT) designed to maintain a presence on victim networks for use in later network exploitation.",Espionage
"The Russian threat actor APT 28 used phishing campaigns to steal credentials from organizations across the world, in government, private sector, and civil society. They also searched the internet for vulnerable webmail servers.",Espionage
"Russian hackers attempted to steal log-in credentials primarily belonging to more than two hundred political campaigns, advocacy groups, parties, and consultants.",Espionage
The North Korean hackers renewed attacks against unnamed cryptocurrency businesses to steal cryptocurrency for financial gain.,Financial Theft
Hackers sent spear-phishing emails to the accounts of officials in various Ukrainian government organizations. The emails contained attachments that downloaded malware when opened.,Espionage
The Iranian state-backed threat actor Charming Kitten impersonated prominent journalists and sent targets fake interview requests in order to steal their credentials and send them malware.,Espionage
Pirate Panda is believed to be responsible for phishing attacks targeting Vietnamese government officials located near the disputed Paracel Islands in the South China Sea.,Other
"Hackers accessed the account of former United Kingdom (UK) Trade Minister Liam Fox, between July 12 and October 21 2019, stealing six tranches of documents detailing British trade negotiations with the United States. Hackers then released the documents as part of a Russian disinformation campaign targeting the 2019 UK general election.",Espionage
"DarkHotel, an advanced actor possibly associated with the South Korean government, attempted to phish World Health Organization employees.",Espionage
The Greenbug group used off-the-shelf tools and living-off-the-land techniques to gain access to South Asian telecommunication providers’ database servers.,Espionage
Responsible for targeting email accounts belonging to former Vice President Joe Biden’s campaign staff and for attempting to discern whether accounts belonging to members of the international affairs community are active.,Espionage
The Chinese threat actor Lotus Blossom used watering holes on fake news sites to deploy iOS exploits against Hong Kong citizens.,Espionage
"APT 40, a threat actor believed to be associated with the Chinese government, allegedly targeted Malaysian government officials with highly targeted spear-phishing attacks in order to install malware and steal confidential documents from government networks.",Espionage
"The Chinese-linked threat actor Pirate Panda sent phishing emails to Vietnamese government officials located in Da Nang, Vietnam.",Espionage
"Hackers used spyware, developed by Israeli technology firm NSO Group, that exploited a vulnerability in the messaging app WhatsApp to inject spyware onto the phones of opposition politicians and prominent religious leaders in Togo. The hack coincided with pro-reform protests in the country.",Espionage
The Chinese threat actor APT 41 attempted to exploit three vulnerabilities at over seventy-five organizations across sectors and countries. This was one of the most widespread attacks by a Chinese threat actor in years.,Espionage
Hackers leveraged a backdoor to compromise Taiwanese and South Korean video game companies’ systems.,Espionage
Responsible for targeting non-campaign email accounts belonging to former Vice President Biden’s election campaign staff. Also responsible for using web bugs to determine whether accounts belonging to academics and important figures in the international affairs community are active.,Espionage
Attempted to trick employees of unnamed U.S. government agency to install malware on their computers via a spearphishing campaign.,Other
"Responsible for orchestrating and executing various operations to protect the United States and its interests, including steps to disrupt the Internet Research Agency and the Trickbot botnet.",Sabotage
The Russia-aligned threat actor Gamaredon intensified its efforts to compromise Ukrainian defense and intelligence targets. The attacks include both cyberespionage and attempted sabotage of physical assets.,Sabotage
The Vietnam-linked threat group uploaded malware-infected apps to the Google Play store to trick users into downloading them onto their phones.,Espionage
Responsible for targeting unpatched network equipment belonging to U.S. government agencies and private companies.,Espionage
"DarkHotel, a South Korea–linked threat actor, used five zero-days in a single campaign targeting North Koreans, demonstrating an unusual level of sophistication.",Espionage
"Hackers used a remote access trojan (RAT), ComRAT v4, to exfiltrate sensitive documents from Central Asian and Eastern European government computers.",Espionage
Iranian hackers attempted to log into accounts associated with the Trump administration and campaign staff.,Espionage
"Devices on a noncritical administrative network in a nuclear power plant in Tamil Nadu, India, were compromised by DTrack, a remote access Trojan (RAT) associated with the Lazarus Group.",Espionage
The DNC alleged it was targeted in an unsuccessful cyberattack eight days after the 2018 elections in an attempted spear-phishing campaign.,Espionage
"A threat actor launched a phishing operation with spoofed login pages to steal the credentials of users at over sixty universities in the United States, United Kingdom, and elsewhere.",Espionage
China’s government used its “Great Cannon” distributed denial of service (DDOS) system for the first time in two years to attack a forum where Hong Kong residents organized protests.,Denial of service
"A threat actor put malicious software on Bayer's computer system but did not steal any information, as reported by the company.",Data destruction
"A threat actor aimed to infect mobile phones belonging to senior members of Tibetan groups, including people who worked directly for the Dalai Lama and lawmakers in Tibet's parliament. The threat actor posed as a human rights worker or journalist and contacted victims through WhatsApp. The campaign involved Android browser vulnerabilities and Android and iOS spyware. The tools appeared in similar attacks, discovered in September, carried out against China's Uighur population.",Espionage
The Russian threat actor Turla took over an Iranian espionage operation belonging to Iranian-linked APT 34 (aka Oilrig) and used it to attack a number of targets while masquerading as Iran.,Espionage
"A threat actor used a Trojan horse to gain remote backdoor access to German energy technology company Siemens, chemical firm BASF, and consumer goods company Henkel. Non-German companies Roche, Lion Air, and Marriott were also targeted.",Espionage
"The China-affiliated threat actor Bronze President attacked nongovernmental organizations, political agencies, and law enforcement in Mongolia and India, among other countries.",Espionage
"Former U.S. government intelligence operatives working for the UAE used the spying tool Karma to hack the iPhones of activists, diplomats, and rival foreign leaders.

 ",Espionage
"A threat actor used the malware BabyShark, which uses infrastructure associated with North Korean campaigns. The malware was delivered in November 2018 via spear-phishing emails written to appear as though they were sent from a nuclear security expert who works as a consultant for the U.S. government. The subject of the emails referenced North Korea's nuclear program.",Espionage
A China-aligned attacker bypassed virtual private network (VPN) accounts protected by two-factor authentication to attack governments and managed service providers in a multitude of industries.,Espionage
"This threat actor hacked global telecommunications companies for personal data of government officials, activists, and dissidents of interest to Beijing.",Espionage
"This threat actor has targeted senior members of Tibetan groups by sending malicious links in WhatsApp messages, while posing as nongovernmental organization workers, journalists, or other fake personas.",Espionage
"China-aligned hackers breached Czech-based Avast’s network, aiming to compromise the CCleaner tool, which had previously been compromised in 2017.",Espionage
A threat actor conducted a phishing attack on investigative journalists at Bellingcat who have been probing Russian intelligence activities.,Espionage
The Russian-speaking threat actor Golden Falcon used a combination of purchased and developed tools to compromise numerous individuals in Kazakhstan and a few in China.,Espionage
"Hackers set up fake login pages or sent spoof e-mails to people who work with the think tanks in an attempt to trick them into handing over information, such as passwords.",Espionage
"A threat actor targeted a number of foreign ministries, a Chinese technology company, Stanford University, think tanks in the United States and the United Kingdom, and other entities that have focused on North Korea's nuclear efforts or the related international sanctions. The threat actor created a network of malicious websites imitating the login portals of targets. This incident is believed to be an extension of the 2018 BabyShark campaign.",Other
"ToTok, a popular Emirati messaging app, was revealed to be a mass surveillance tool used by the Emirati government.",Espionage
U.S. Cyber Command hacked Iranian rocket and missile launch systems in retaliation for the downing of a U.S. drone and attacks on oil tankers in the Strait of Hormuz. Iranian officials said the attack was not successful.,Sabotage
A threat actor launched a persistent campaign against the Foreign Ministry of the Czech Republic that lasted several months. This campaign follows previous attacks on the Czech Foreign Ministry in 2018 and 2017.,Espionage
Russian group Sandworm carried out large-scale cyberattacks against targets in Georgia.,Sabotage
"Between July 19 and July 25, 2019, a threat actor sent several spear-phishing emails to three U.S. companies in the utility sector. The emails were sent from a domain impersonating that of the National Council of Examiners for Engineering and Surveying, an authority in the industry. The emails contained Microsoft Word attachments that used macros to install and run a new remote-access Trojan (RAT) called LookBack.",Espionage
"Threat actor that has targeted Kazakh government officials and private individuals, along with some Chinese individuals.",Other
"Hackers used malware from the dark web to target a Norwegian internet service provider. The goal of the attack was to gain access to customers’ intellectual property, strategic plans, and emails.",Espionage
"A threat actor targeted U.S.-based entities by emailing them malware-laced Microsoft Word documents written by industry experts. The trojanized documents discussed nuclear deterrence, North Korea's nuclear submarine program, and economic sanctions on the North Korean regime. This incident is believed to be an extension of the August Autumn Aperture campaign.",Other
"Iran-aligned threat actor APT 33 targeted industrial control system manufacturers, suppliers, and maintainers.",Espionage
"This threat actor deployed Regin, a rare type of malware, in an attempt to spy on user accounts for Yandex, a Russian search engine and email provider.",Espionage
"Multiple threat actors compromised telecoms networks across Central and Southeast Asia. The attacks were part of a wider cyber-espionage campaign targeting diplomats and state officials, and they signal China's ability and intent to track the movements of Uighurs along a number of transit routes that they use to escape state persecution.",Espionage
Two Chinese government threat actors used a number of zero-day vulnerabilities in common Japanese software to target Japanese organizations over the course of several years.,Espionage
"The threat actor exploited office devices’ weak, outdated security to access the networks of several Microsoft customers and infiltrate accounts with more privileges.",Other
"Gamaredon, a Russian-speaking APT, targeted Ukrainian government entities from September to November 2019.",Espionage
"In November 2018, the U.S. Cyber Command launched an offensive campaign to combat a Russian troll operation known for using disinformation tactics.",Denial of service
"Using a new wiper malware called ZeroCleare, Iranian-linked threat actor APT 34 (aka Oilrig) targeted oil companies in the Middle East.",Data destruction
