Description,Type
A threat actor used a tool called VPNFilter to target a chemical plant in eastern Ukraine that provides chlorine to water- and sewage-treatment plants in that country. Ukraine’s intelligence service claims to have thwarted the incident.,Sabotage
The Mexican government is suspected of using spyware to infiltrate journalists’ messages.,Espionage
"This threat actor targets governments as well as technology, education, and telecommunications companies primarily in Asia and the United States, for the purpose of espionage.",Espionage
"A threat actor uses a tool, called Olympics Destroyer, to target financial organizations in Russia and biological and chemical laboratories in Ukraine and other countries in Europe.",Espionage
"A threat actor targeted the personal email accounts of U.S. senators and staffers, according to Senator Ron Wyden (D-OR) and an unnamed technology company.",Espionage
A threat actor has compromised the network of Australian National University for espionage purposes.,Espionage
"A threat actor compromised the Canadian Centre for Ethics in Sport. Seven of the individuals alleged to be behind this incident, believed to be Russian military intelligence (known as GRU), were indicted by the U.S. Justice Department. Canada issued a statement attributing the incident to Russian military intelligence.",Doxing
"A threat actor attempted to compromise Bellingcat, a citizen journalism website that conducts investigations, including about Russian involvement in the Syrian and Ukrainian conflicts.",Espionage
"A threat actor used a tool called WannaCry to encrypt data in compromised networks, and intended to provide the victims with the decryption key only after a ransom had been paid. The threat actors used an exploit, called EternalBlue--first discovered by the U.S. National Security Agency--to propagate WannaCry in organizations using the Windows operating system. On December 19, 2017, the United States, Australia, Canada, Japan, and the United Kingdom issued statements accusing North Korea of being responsible for WannaCry.

In September 2018, the U.S. Department of Justice announced criminal charges alleging that North Korean entities were responsible for this incident.",Data destruction
"This threat actor is an Iranian state-sponsored APT that targets private-sector entities in the aviation, energy, and petrochemical sectors for the purpose of espionage. It first became active in late 2015 or early 2016, and has been involved in a three-year campaign against multiple firms in the United States and Saudi Arabia. On December 19, 2018, McAfee attributed the 2016 and 2017 Shamoon wiper malware attacks on several companies in the Middle East and Europe to APT 33.",Espionage
"A threat actor targeted Ethiopian dissidents for the purpose of espionage, using commercially available spyware sold by Cyberbit, an Israel-based company. Cyberbit is also believed to have tried to sell its spyware to law enforcement and national security organizations in the Philippines, Thailand, Uzbekistan, and Zambia.",Espionage
"A threat actor targeted servers controlled by the Swiss Federal Department of Defense, Civil Protection, and Sports.",Espionage
A threat actor targeted cryptocurrency exchanges in South Korea for the purpose of raising money.,Financial Theft
"Using a tool called Bad Rabbit, a threat actor launched a ransomware operation that encrypted data on networks in Bulgaria, Japan, Russia, Turkey, and Ukraine. The operation is believed to have disrupted the Kiev metro system's payment network and delayed flights at Odessa's airport. In October 2018, the United Kingdom attributed this incident to Russian military intelligence.",Sabotage
"This threat actor targets governments, primarily in the Middle East and South Asia, for espionage purposes.",Espionage
"A threat actor compromises the networks of the International Association of Athletics Federations with the purpose of obtaining the medical records of athletes. In October 2018, the United States indicted seven alleged Russian military intelligence officials involved in the incident.",Espionage
"A threat actor targeted individuals who were political critics and business rivals of Ricardo Martinelli, president of Panama between 2009 and 2014, for espionage purposes. The threat actor uses the Pegasus tool, created by the NSO Group.",Espionage
"A threat actor compromised the networks of Far Eastern International Bank in Taiwan, allowing them to transfer US$60 million to accounts based in the United States, Cambodia, and Sri Lanka using the SWIFT network.",Financial Theft
"A threat actor compromised Islam Channel, a small UK TV station, in July 2015. In October 2018, the United Kingdom publicly attributed the compromise to Russian military intelligence.",Espionage
"This threat actor targets defense contractors, law firms, engineering firms, shipping companies, and government agencies with responsibilities or business in the maritime industry.",Espionage
"Threat actors deploy a tool, called NotPetya, with the purpose of encrypting data on victims' machines and rendering it unusable. The malware was spread through tax software that companies and individuals require for filing taxes in Ukraine. Australia, Estonia, Denmark, Lithuania, Ukraine, the United Kingdom, and the United States issued statements attributing NotPetya to Russian state-sponsored actors. In June 2018, the United States sanctioned Russian organizations believed to have assisted the Russian state-sponsored actors with the operation. ",Data destruction
"This threat actor, using a tool called JadeRAT, targets the mobile phones of ethnic minorities in China, notably Uighurs, for the purpose of espionage.

 ",Espionage
"This threat actor targets organizations in the critical infrastructure, heavy industry, manufacturing, and international relations sectors for espionage purposes.",Espionage
"The U.S. Department of Justice indicted three members of Boyusec, a China-based internet security firm, on charges including conspiring to commit computer fraud and abuse and conspiring to commit trade-secret theft. The victims included Moody’s Analytics, Siemens, and Trimble. Though not mentioned in the indictment, Boyusec is believed to work on behalf of China’s Ministry of State Security.",Espionage
This threat actor targets managed information technology service providers to access client information for espionage purposes. APT 10 has been active since at least 2009.,Espionage
"A threat actor, believed to be the Israeli government, compromised Kaspersky Labs, a Russia-based cybersecurity company. The compromise of Kaspersky allegedly led Israeli intelligence to tip off U.S. officials that a former contractor had classified data from the National Security Agency on his home computer.",Espionage
"This threat actor targets organizations in the financial, energy, government, chemical, and telecommunications sectors worldwide for the purpose of espionage.",Espionage
Greenbug is believed to be an Iranian threat actor with ties to the group behind the Shamoon malware. It has previously used off-the-shelf tools and living-off-the-land techniques to gain access to South Asian telecommunication companies’ servers. It has also used custom remote access trojans (RAT) to steal information and credentials from Middle Eastern targets.,Other
"A threat actor targeted the government of Belarus for espionage purposes, using a tool known as Travle or PYLOT, which is believed to be an update of malware used by NetTraveler.",Espionage
"A threat actor targeted the China Digital Times, a civil-society and news organization based outside China that publishes English- and Chinese-language content, using phishing techniques with the goal of compromising its network.",Espionage
"A threat actor attempted to gain access to email accounts associated with members and other staffers of the British Parliament. The incident, originally believed to be the work of Russian or North Korean actors, was later attributed to Iran.",Espionage
"This threat actor targets government institutions, universities, defense contractors, and large IT companies for the purpose of espionage.",Espionage
"A threat actor compromised the computer networks of the Ministry of Foreign Affairs of the Czech Republic, including those used by the foreign minister and close aides.",Espionage
This threat actor targets government organizations with a foreign policy role primarily in Latin America for espionage purposes. The threat actor uses the tools Felismus and Starloader.,Espionage
A threat actor targeted U.S. electric companies with spear-phishing emails in an attempt to gain access to internal networks.,Espionage
"Qatar claims the website of the Qatar News Agency was compromised by an unknown actor, who posted false remarks attributed to the Emir of Qatar that expressed support for Iran, Israel, Hezbollah and Hamas. The Washington Post reports that U.S. intelligence officials have identified the unknown actor as the United Arab Emirates.",Defacement
"A threat actor targeted the computer networks of the Norwegian government: the Ministry of Foreign Affairs, the army, a nuclear radiation protection agency, and a parliamentary group.",Espionage
"A threat actor used a tool called ViperRAT to target Israeli Defense Force personnel and compromise devices running the Android operating system, allowing a remote actor to access the devices' video and audio capabilities as well as text message and location data.",Espionage
"A threat actor targets journalists, lawyers, and other civil society groups in Mexico using commercial malware, developed by the NSO Group, for the purpose of espionage.",Espionage
"U.S. government officials told the Washington Post that the United States had launched a denial of service campaign against North Korea's Reconnaissance General Bureau, the country's intelligence agency.",Denial of service
A threat actor launched a distributed denial of service attack against government of Montenegro websites.,Denial of service
"A threat actor compromised an internet-facing computer network in the Ministry of Defense of Singapore, compromising the personal data of approximately 850 servicemen and employees.",Espionage
"A threat actor, believed to be the United States, targeted computer networks and electronic components associated with the North Korean nuclear program to sabotage and slow its development.",Sabotage
A threat actor targeted the presidential campaign of U.S. Senator Marco Rubio.,Espionage
"This threat actor compromises governments, international organizations, academic institutions, and financial, telecommunications, energy, aerospace, information technology, and natural resource  industries for espionage purposes. Some of the tools used by this threat actor were released by Wikileaks under the name ""Vault 7.""",Espionage
A threat actor targeted officials from Montenegro for the purpose of espionage. The phishing campaign came during the country’s accession to NATO.,Espionage
"A threat actor compromised an email service maintained by the Danish Ministry of Defense, and is also believed to have compromised Ministry of Foreign Affairs networks.",Espionage
A threat actor targeted the campaign of French presidential candidate Emmanuel Macron. The U.S. National Security Agency has confirmed that it believes Russia was responsible.,Espionage
"This threat actor targets entities in the government, energy, and technology sectors that are located in or do business with Saudi Arabia.",Espionage
This threat actor targets defense contractors and diplomatic institutions for the purpose of espionage.,Espionage
A threat actor compromised the Italian Ministry of Foreign Affairs’ computer networks.,Espionage
"This threat actor targets critical infrastructure entities in the oil and gas sector, primarily in Ukraine. The threat actors deploy the BugDrop malware to remotely access the microphones in their targets' computers to eavesdrop on conversations.",Espionage
"A threat actor targeted employees of companies that operate nuclear power plants in the United States, which prompted the Department of Homeland Security and the FBI to issue an alert to the industry. An administrative network of the Wolf Creek Nuclear Operating Corporation was compromised.",Espionage
"A threat actor conducted a spear-phishing campaign against more than 1,800 Google accounts, including those of military and government personnel, journalists, and nongovernmental organizations, for the purpose of espionage.",Espionage
"This threat actor targets and compromises entities primarily in South Korea and South Korean interests for espionage, disruption, and destruction. It has also been known to conduct cyber operations for financial gain, including targeting cryptocurrency exchanges. In 2018, the U.S. Department of Homeland Security issued a malware analysis report on a tool called Typeframe used by the Lazarus Group.

In September 2018, the U.S. Department of Justice criminally charged and sanctioned Park Jin-hyok and Chosun Expo Joint Venture, alleged members of this threat actor.",Espionage
A threat actor used malware known as Shamoon 2.0 to exfiltrate and delete data from computers in the Saudi transportation sector.,Data destruction
"A threat actor targets the worldwide financial transfer mechanism known as SWIFT to steal funds from banks in Bangladesh, Vietnam, Ecuador, and Poland. This is the first instance in where a state-sponsored actor was discovered to have compromised networks for financial gain.

In September 2018, the U.S. Department of Justice announced criminal charges alleging that North Korean entities were responsible for this incident.",Financial Theft
"A threat actor compromised computers associated with the South Korean Ministry of National Defense. In October 2017, South Korean officials confirmed that North Korea had exfiltrated over two hundred gigabytes of data from the defense ministry networks, including military plans the United States and South Korea would implement in the event of a war with North Korea.",Espionage
"A threat actor launched a denial of service attack on ten news websites in Sweden, triggering a local police investigation. U.S. diplomatic cables later revealed that the United States suspected that Russia was responsible for the incident.",Denial of service
A threat actor compromised Ukrainian banks.,Data destruction
"This threat actor targets civil society groups and Emirati journalists, activists, and dissidents.",Espionage
"In June 2016, suspected Russian threat actors were discovered in the networks of the U.S. Democratic National Committee (DNC). Intruders gained access to its research on Republican presidential candidate Donald J. Trump and emails and correspondences among DNC officials. Over the course of the presidential campaign, the threat actors released DNC correspondence through intermediaries such as WikiLeaks, revealing information about infighting among top party officials and leading to the resignation of the DNC chair. The threat actors also went after John Podesta, chairman of Hillary Clinton’s campaign, and released more embarrassing data throughout the summer.

The secretary of homeland security and the director of national intelligence released a joint statement asserting that the protracted cyber espionage campaign was the work of Russian actors. The Barack Obama administration subsequently sanctioned Russian intelligence officials and deported suspected officers working in the United States. The DNC compromise is believed to be part of a larger Russian espionage campaign waged for the purpose of manipulating the electoral systems in Western democracies and undermining faith in the democratic process in the United States, France, Germany, and elsewhere.

In July 2018, the U.S. Department of Justice indicted twelve officials of the Russian military intelligence agency, known as GRU, believed to have been responsible for this incident.

 

In October 2018, the UK government announced that the compromise was the work of Russian military intelligence.",Espionage
"A threat actor believed to be Iran that targets private-sector and government entities for the purpose of espionage. In October 2019, revealed to have been compromised by Turla. Some operations previously attributed to the group may be Turla false flags.",Espionage
"The United States announced that it would conduct offensive cyber operations against the Islamic State with a view to disrupting its ability to recruit, communicate with, and exercise command and control over its fighters.",Sabotage
"A threat actor compromised computer networks that control an electricity substation in the north of the Ukrainian capital, Kiev, causing a power outage. To accomplish its task, the threat actor used a tool known as CrashOverride. ",Sabotage
"The World Anti-Doping Agency (WADA) confirmed in September 2016 that it had been compromised by suspected Russian threat actors in a data leak of confidential information about forty-one athletes who competed in the Rio Olympic Games. The data revealed drug-test results and medical data pertaining to “therapeutic use exemptions,” situations in which WADA allows athletes to take banned substances if their usage is deemed legitimate.

A group using the Fancy Bear moniker, the same term some security experts assign to a Russian state-sponsored threat actor, claimed responsibility for the compromise. Some commentators viewed the incident as Russian retaliation for a WADA report that detailed Moscow-sanctioned efforts to provide performance-enhancing drugs to Russian athletes during the 2014 Sochi Winter Olympics.

The United States, Australia, Canada, New Zealand, and the United Kingdom issued statements attributing the incident to Russian military intelligence. Separately, the United States issued an indictment against seven alleged Russian military intelligence officials involved in the incident.",Espionage
"A threat actor uses a tool called PassCV to target video game companies, stealing digital certificates to use in cyber operations against other targets.",Espionage
"A threat actor used FinFisher, also known as FinSpy, to infect mobile phones and computers and place targets under surveillance. The threat actor, allegedly the Indonesian government, used a proxy server inside the Global Switch Sydney East data center in Ultimo, Australia, to obscure their identity.",Espionage
"A threat actor compromised over approximately five hundred million accounts, giving it access to the names, email addresses, telephone numbers, and dates of birth associated with the accounts. Yahoo discloses that the compromise took place in 2014.",Espionage
A threat actor attempted to compromise the networks of U.S. think tanks associated with international affairs and national security. The attempts occurred shortly after the U.S. election in 2016.,Espionage
"This threat actor compromises civil society groups the Chinese Communist Party views as hostile to its interests, such as Tibetan, Uyghur, Hong Kong, and Taiwanese activist. The threat actor also targeted the Myanmar electoral commission.",Espionage
"This threat actor targets governments and businesses of multiple countries, including the United States, Israel, and Denmark.",Espionage
A threat actor compromised Burmese websites in an attempt to compromise visitors to those websites for espionage purposes.,Espionage
Russian authorities warned that a foreign intelligence agency was seeking to compromise its banking sector.,Data destruction
"This threat actor targets the South Korean government, transportation, and energy sectors.",Espionage
"This threat actor compromises government and critical infrastructure entities, primarily in Myanmar, for espionage purposes.",Espionage
A threat actor compromised a Swiss defense contractor.,Espionage
This threat actor is based in the Middle East (possibly Iran) and targets English- and Persian-language organizations. It is alleged to be the same group behind a compromise of the Danish Ministry of Foreign Affairs.,Espionage
"A threat actor exploited a vulnerability in Yahoo's account log-in process, allowing it to access user accounts without a password. Approximately thirty-two million accounts were affected.",Espionage
"This threat actor compromises targets in the Military, telecommunications, and financial sectors in Belgium, China, Iran, Russia, Sweden, and elsewhere.",Espionage
"A threat actor targeted the Department of Justice of the Philippines, the Asia-Pacific Economic Cooperation (APEC), and a major international law firm representing one of the parties in the dispute over the Scarborough Shoal.",Espionage
This threat actor targets government and military organizations in Egypt and Israel for espionage purposes.,Espionage
"Threat actors targeted the email accounts of South Korean diplomats, journalists, and security officials.",Espionage
A threat actor compromised a mobile app that Ukrainian artillery units used to assist with targeting. The compromise of the app is believed to have allowed the threat actor to monitor the movements of Ukrainian units in order to facilitate military targeting by Russian-backed rebels in eastern Ukraine.,Espionage
"This threat actor targets and compromises Japanese and Taiwanese entities in the finance, tech, media, and government sectors.",Espionage
Threat actors targeted lawyers and exiled Kazakh dissidents for the purpose of espionage.,Espionage
"A threat actor compromised the networks of the German parliament for the purpose of espionage. In May 2020, Germany’s federal prosecutor issued an arrest warrant against Russian citizen Dmitry Badin, who is believed to be a member of Russia’s elite hacking unit, APT 28. Afterward, Germany asked European Union governments to impose the bloc’s first cyber sanctions on Badin.",Espionage
"In December 2015, a threat actor compromised power distribution companies in western Ukraine, causing a power outage for more than 230,000 residents. Several control centers were targeted by suspected Russian hackers, who were able to siphon operator credentials and gain access to the power grid for the Ivano-Frankivsk region. The power outage lasted as long as six hours in some areas. During the outage, threat actors also flooded customer services phone lines with calls to prevent customers from reporting the incident.

The compromise of the Ukrainian power grid was an escalation from previous disruptive incidents and the first confirmed cyber operation to successfully take down energy infrastructure. The incident set an ominous precedent for the security of power grids around the world. The electricity distribution system in Ukraine was again targeted in 2016.",Sabotage
This threat actor uses spear-phishing techniques to target government and private sector agencies in the South China Sea region.,Espionage
"A threat actor compromised a U.S. health insurance company, resulting in compromised personal data on eighty million customers.",Espionage
"This threat actor, known to use watering-hole attacks to compromise victims, targets organizations of interest to the Vietnamese government for espionage purposes. Victims have included human rights organizations, research institutes and maritime construction firms in China, and media organizations. Also believed to have been responsible for disclosing confidential Filipino government documents. ",Espionage
This threat actor targets government agencies and entities in the defense and energy sectors in Southeast Asia with an interest in issues related to tensions in the South China Sea.,Other
A Russian-linked threat group known as Gamaredon uses custom-developed malware in attacks aimed at Ukraine. The group has been active since at least 2013.,Espionage
"A threat actor, using a tool dubbed Duqu 2.0, targeted individuals and companies linked to the P5+1 (the five permanent member states of the UN Security Council, plus Germany), which was conducting negotiations on Iran's nuclear program.",Espionage
"This threat actor targets organizations in the aerospace, technology, telecommunications, and engineering sectors for the purpose of espionage.",Espionage
"This threat actor targets and compromises entities in the defense, construction, technology, and transportation sectors. Up until 2015, it was primarily focused on U.S. and UK entities, but it shifted to Hong Kong–based targets afterward. The U.S. Department of Justice indicted three members of this threat actor group in November 2017 for compromising the networks of three U.S. companies.",Espionage
"This threat actor compromises web pages to lure targets for espionage purposes. It focuses on the aerospace, automotive, technology, and energy sectors, primarily in the United States and United Kingdom.",Espionage
