Description,Type
This threat actor increased malicious activity targeting U.S. companies following a U.S. attack on Iranian computer systems.,Data destruction
The China-linked threat actor group Rancor targeted unnamed Cambodian government entities.,Espionage
A Chinese-linked threat actor group active in Southeast Asia,Other
"This threat actor has, since 2014, conducted operations backed by the Chinese government, including targeting the health-care and high-tech sectors and conducting espionage against political dissidents. It has simultaneously conducted its own for-profit illicit activity in the video games industry, amassing millions of dollars in digital currency to be sold to gamers on the black market. The threat actor operates outside of state control but is linked to other Chinese APT malware actors and tools on a part-time or contractual basis, or is a full-time, state-sponsored APT actor that simultaneously conducts nonstate campaigns for supplemental income. This threat actor is a notable example of the blurring lines between state-sponsored and commercial cyber criminals.",Espionage
"Gamaredon, a Russian-speaking APT, targeted Ukrainian government entities from September to November 2019.",Espionage
"Chinese hackers targeted twenty-seven universities in the United States, Canada, and Southeast Asia as part of a scheme to steal research about maritime technology under development for military use.",Espionage
"A threat actor targeted the email accounts of an unnamed U.S. presidential campaign, current and former U.S. officials and journalists, and others. During a thirty-day period in August and September, Microsoft observed more than 2,700 attempts to identify the emails of specific customers and 241 hacks.  Four accounts were compromised, though not those connected to the presidential campaign or the officials. A threat actor linked to the Iranian government unsuccessfully attempted to break into President Donald J. Trump's reelection campaign, according to sources familiar with the incident. ",Espionage
Chinese government hackers attacked the National Association of Manufacturers to steal information that might be useful in U.S.-China trade negotiations.,Espionage
"The Iran-aligned espionage group APT 33 used botnets to launch a campaign against a small number of victims in the public and private sectors in the United States, Asia, and the Middle East.",Espionage
Chinese government threat actor PKplug targeted organizations in East and Southeast Asia.,Espionage
"A threat actor broke into the systems of Bahrain's National Security Agency, Ministry of Interior, and office of the first deputy prime minister. On July 25, 2019, Bahraini authorities detected intrusions into its electric and water authority that shut down several systems. The attacks were similar to two hacks in 2012, in which the Shamoon virus was used to knock Qatar's natural gas firm RasGas offline and wipe data from the hard drives at Saudi Aramco, Saudi Arabia's national oil company.",Sabotage
"Gamaredon, a Russian-speaking APT, targeted Ukrainian government entities from September to November 2019. ",Espionage
"This threat actor has been active since mid-2017, targeting mainly health-care, media, telecommunications, and engineering organizations in Singapore, in addition to multinational companies with a presence in the country. The group has also targeted defense, telecommunications, and energy companies in Russia, the United Kingdom, and Southeast Asia. The group relies on a combination of custom malware, open-source hacking tools, and legitimate applications to achieve its goals.",Other
North Korean hackers attacked the Indian Space Research Organization as part of a broader assault on India’s government agencies.,Espionage
China-linked espionage group Bronze Butler targeted companies with head offices in Japan and subsidiaries in China to try to steal highly classified information.,Espionage
"Iranian threat actor Phosphorus attacked 241 email accounts associated with a U.S. presidential campaign government officials, and journalists, and prominent expatriate Iranians.",Espionage
"Hong Kong authorities used a network of Chinese computers to track protesters' organizing activity on Telegram, a secure messaging app.",Espionage
"Gamaredon, a Russian-speaking APT, targeted Ukrainian government entities from September to November 2019.",Espionage
Senior Indonesian election officials accused Chinese and Russian hackers of manipulating and modifying Indonesia's voter data base to disrupt the presidential elections.,Espionage
"A threat actor targeted virtual private networks (VPNs) used by suppliers of European aerospace company Airbus with a series of attacks. The attacks resulted in unauthorized access to data, including the theft of documents related to Airbus's military transport plane A400M, designed with one of the most powerful propeller engines in the world.",Espionage
"The Egyptian government installed mobile apps on targets’ phones to extract files, track their locations, and identify contacts.",Espionage
A threat actor targeted the computer network of the Parliament of Australia. The hackers breached the Parliament's network and the networks of the three largest political parties.,Espionage
The North Korean threat actor Lazarus Group targeted South Korean macOS users with a new malware variant.,Espionage
ESET researchers discovered a new malware called Attor that has been used to target only a few dozen victims since 2013. The victims include diplomatic and government institutions and the malware is designed to steal encryption information from certain applications.,Espionage
"Multiple threat actors compromised and exploited eleven websites that published news and cultural information related to the Uighur populations in China, particularly the East Turkestan region. The threat actors imitated the domains of Google, the Turkistan Times, and the Uyghur Academy, and used Google applications to gain access to Gmail accounts. Among other sensitive details collected were the hacked devices’ unique identification numbers, phone numbers, locations, central processing unit (CPU) data, and usernames.",Espionage
"Ocean Lotus (aka APT 32), a threat actor aligned with the Vietnamese government, attacked BMW and Hyundai in an attempt to steal automotive trade secrets.",Espionage
The threat actor repurposed hacking tools used against them by the U.S. National Security Agency (NSA) to attack private companies in Asia and Europe. These attacks went undetected for two years.,Espionage
A threat actor conducted a multiyear espionage effort aimed at the theft of intellectual property from European and North American aerospace companies to further the development of China's C919 aircraft.,Espionage
"Unit 02616 of Uzbekistan’s National Security Service used FinFisher, a German spyware, to attack dissidents.",Espionage
"This threat actor, believed to be linked to Saudi Arabia, targets Saudi dissidents and foreign journalists with NSO Group's Pegasus malware. ",Other
"U.S. Cyber Command conducted operations to disable online activities of the Internet Research Agency (IRA), a Russia-based company closely affiliated to the Russian government that conducts information operations. The operation was meant to prevent the IRA from interfering in the 2018 U.S. midterm elections.",Sabotage
Multiple threat actors targeted secure sockets layer (SSL) virtual private network (VPN) servers provided by cybersecurity companies Fortinet and Pulse Secure. It is uncertain whether the attacks were successful.,Other
"Gallium, an allegedly China-aligned threat actor, attacked telecom companies across the globe for several months.",Espionage
This threat actor compromised Amnesty International Hong Kong's system to steal the personal information of supporters.,Espionage
The United States carried out a cyberattack against Iran designed to limit Tehran’s ability to spread propaganda in retaliation for the September 14 attacks on Saudi oil facilities.,Data destruction
"DarkUniverse was a threat group affiliated with Russia that was active for at least eight years, from 2009 until 2017.",Other
Amnesty International released a report showing how Morocco’s government used the NSO Group’s Pegasus malware to target two human rights activists in Morocco.,Espionage
An unknown actor with a connection to Iran hijacked DNS records to target the traffic of governments and telecommunications organizations around the world.,Espionage
Gallium is a possibly China-linked threat actor that has carried out attacks against telecom companies across the globe.,Other
"A threat actor compromised the British Post Office and local government networks, stealing personal data—including email addresses and mobile phone numbers—of thousands of employees.",Espionage
"A threat actor targeted embassies and foreign ministries in Eastern Europe and Central Asia with a phishing campaign that deployed a form of Zebrocy malware on computers, creating backdoors. ",Other
"Believed to have gone dark, Russian threat actor the Dukes targeted the ministries of foreign affairs of three European countries and a European Union (EU) country embassy in the United States with malware.",Espionage
"German security officials detected a cyberattack, believed to be by the Russian group Snake, on the email accounts of German celebrities, lawmakers, military officials, and staff of several German embassies.",Doxing
"A threat actor compromised air-gapped, or isolated, networks owned by U.S. electric utility companies by penetrating the networks of trusted vendors.",Sabotage
"A threat actor successfully compromised the networks of the Dukes, gaining visibility into the Dukes’ targeting methods and operations. This compromise allegedly helped the U.S. intelligence community to attribute the 2016 compromise of the Democratic National Committee and other entities to Russian state-sponsored actors.",Espionage
"A threat actor targets German media companies and organizations involved in chemical weapons research, for the purpose of espionage.",Espionage
"This threat actor targets government and private-sector entities in the defense, maritime, and science and technology sectors in China for espionage purposes. It is particularly interested in information related to cross–Taiwan Strait and U.S.-Sino relations.",Espionage
"This threat actor targets Uighurs—a minority ethnic group located primarily in northwestern China—and devices from Chinese mobile phone manufacturer Xiaomi, for espionage purposes.",Espionage
"A threat actor compromised the Federation Internationale de Football Association (FIFA). Seven of the individuals alleged to be behind this incident, believed to be Russian military intelligence (known as GRU), were indicted by the U.S. Justice Department.",Espionage
"This threat actor, which consists of Stealth Mango (Android) and Tangelo (iOS), targets government officials, diplomats, military personnel, and activists in primarily Afghanistan, India, Iraq, Pakistan, and the United Arab Emirates for espionage.",Espionage
"The office of U.S. Senator Claire McCaskill (D-MO) announced that it was targeted by Russian state-sponsored cyber actors, following a report of the incident in the Daily Beast.",Espionage
Marriott reported a massive data breach that affected up to five hundred million customers in its Starwood hotels reservation system. U.S. private investigators believe China is behind the hack.,Espionage
"A threat actor, using a tool called Olympic Destroyer, successfully disrupted computer networks associated with the 2018 Winter Olympics in Pyeongchang, South Korea, before the opening ceremony. Among other things, the incident crashed the Wi-Fi network in the Olympic stadium and the press center.",Sabotage
"This threat actor targets organizations in the satellite communications, telecommunications, geospatial-imaging, and defense sectors in the United States and Southeast Asia for espionage purposes.",Espionage
This threat actor targets universities around the world for espionage purposes.,Espionage
"The United Kingdom’s Government Communications Headquarters director announced that, along with the UK Ministry of Defense, it had conducted a “major offensive cyber campaign” directed at the Islamic State, with the purpose of disrupting the group’s ability to recruit and coordinate. The UK campaign mirrors a previous one announced by the U.S. government in 2016.",Sabotage
"A threat actor targeted Westinghouse Electric Company, a nuclear power developer, for espionage purposes. One of the individuals alleged to be behind this incident, believed to be Russian military intelligence (known as GRU), was indicted by the U.S. Justice Department.",Espionage
"A threat actor targets North Korean defectors and journalists with an interest in North Korea by compromising their Android devices, for espionage.",Espionage
This threat actor targets entities that operate industrial control systems in the electric utility sector.,Espionage
Ukraine’s security agency thwarted an attack attempting to target the country’s court system.,Espionage
"This threat actor uses social engineering techniques to target companies in the chemicals, electronics, manufacturing, aerospace, automotive, and health-care sectors, as well as the South Korean government.",Other
"A threat actor targeted critical infrastructure entities in the energy, water, and telecommunications sectors, prompting the German government to issue a public alert. In remarks following the alert's release, the head of Germany’s domestic intelligence agency accused Russia of controlling the targeting campaign.",Espionage
"A threat actor targeted the iPhone of Omar Abdulaziz, a critic of the Kingdom of Saudi Arabia living in Canada, for espionage purposes. The threat actor uses the Pegasus tool, created by the NSO Group.",Espionage
A threat actor has compromised a government data center in Mongolia. Kaspersky Lab assesses that the threat actor used its access to compromise websites that they will use in subsequent watering-hole attacks.,Espionage
"The U.S. Department of Homeland Security and the UK National Cyber Security Centre issued a joint alert warning of a Russian state-sponsored campaign to compromise networking equipment, such as routers and switches, to support their cyber operations. A few weeks later, the FBI took control of a botnet with over five hundred thousand compromised devices and issued a public request that individuals with certain router models restart them.",Sabotage
This threat actor targets government entities in the United States and Europe. It also conducts criminal operations.,Espionage
"An attack targeted computer systems in both houses of the Parliament of Australia. The systems of the ruling Liberal-National Coalition Party and Labor, the main opposition party, were compromised, but there is no evidence of electoral interference.",Other
"A threat actor compromised the Informationsverbund Berlin-Bonn, a computer network air gapped from the global internet, used by the German chancellery, parliament, Foreign Office, and other government departments based in Bonn, Germany.",Espionage
"This threat actor targets Tibetan organizations based in India, for the purpose of espionage.",Espionage
A threat actor targets the campaigns of candidates running for Congress in the 2018 U.S. midterm elections.,Espionage
"Two separate threat actors targeted South Korean government organizations prior to the meeting between U.S. President Donald J. Trump and North Korean leader Kim Jong-un, for the purpose of espionage.",Espionage
"The U.S. Department of Justice indicted nine officials from the Mabna Insititute, an Iranian company alleged to have conducted state-sponsored cyber operations on behalf of the Iranian Revolutionary Guards. They are alleged to have compromised the networks of over 144 U.S. universities, 176 universities in over twenty-one other countries, as well as private sector, government, and multilateral entities.",Espionage
"This threat actor uses spear-phishing techniques to target political organizations in Southeast Asia, for the purpose of espionage.",Espionage
"A threat actor targeted Yahya Assiri, a critic of the Kingdom of Saudi Arabia and a researcher at Amnesty International, for espionage purposes. The threat actor used the Pegasus tool, created by the NSO Group.",Espionage
"A threat actor compromises the networks of SingHealth, the largest health-care provider in Singapore. Personal data of over 1.5 million patients was compromised, including the pharmaceutical prescriptions of 160,000 people.",Espionage
"This threat actor targets organizations in the finance, defense, aerospace, technology, health-care, and automotive sectors and media organizations in East Asia for the purpose of espionage. This threat actor is also known for targeting a South Korean company that produces USB sticks generally used to transfer data to air-gapped networks.",Other
"A threat actor is targeting multiple organizations with trade ties to China, including those connected with China’s Belt and Road Initiative. The actor also targets organizations in advance of officials’ meetings with Chinese trade officials.",Espionage
"This threat actor, operating since November 2014, focuses on the Middle East. It mainly targets the telecommunications industry, and also targets the travel industry and supporting IT firms, and the high-tech industry.",Other
A threat actor targeted a foreign ministry in Europe and in North America using spear-phishing techniques for the purpose of espionage.,Espionage
"This threat actor uses spear-phishing techniques to target parliaments, government ministries, academics, and media organizations, primarily in the Middle East, for the purpose of espionage.",Espionage
"A threat actor targets critical infrastructure and organizations in the entertainment, finance, health-care, education, and telecommunications sectors.",Espionage
"This threat actor reportedly intruded into American aerospace companies' computer systems to steal intellectual property and business information, including information related to turbofan engines used in commercial aircraft.",Espionage
"A threat actor has compromised the German Foreign Office, for the purpose of espionage.",Espionage
"In a series of incidents, Chinese hackers breached U.S. Navy contractors’ systems to steal information including ship maintenance data and missile plans.",Espionage
"A threat actor targeted a European defense agency with a spear-phishing email, which only deploys a payload if the victim opens an email attachment and scrolls to page 3.",Espionage
"This threat actor uses spear-phishing techniques to target embassies and private-sector energy, defense, aerospace, research, international economics, and media organizations in Africa, Europe, and the Middle East, for the purpose of espionage. It was first identified in 2014 and has been active since.",Espionage
This threat actor targets Japanese media and defense companies for espionage purposes.,Espionage
"This threat actor, whose activities date back to 2014, conducts long-term operations to collect strategic intelligence. They target U.S. and Middle Eastern defense, diplomatic, and government personnel, as well as private industries, including media, energy, business services, and telecommunications.",Espionage
"This threat actor targets software companies and political organizations in the United States, China, Japan, and South Korea. It primarily acts to support cyber operations conducted by other threat actors affiliated with Chinese intelligence services.",Espionage
"This threat actor targets organizations involved in oil, gas, and electricity production, primarily in the Gulf region, for espionage purposes. According to one cybersecurity company, the threat actor “compromises a target machine and passes it off to another threat actor for further exploitation.”",Espionage
A North Korean group is believed to have stolen hundreds of millions of dollars by infiltrating the computer systems of banks around the world since 2014.,Financial Theft
"The threat actor compromised eight technology service providers, including Hewlett Packard Enterprise and IBM (their cloud services in particular were targeted), to steal commercial secrets from over forty-five client technology companies. The victims include Swedish telecom giant Ericsson, U.S. Navy shipbuilder Huntington Ingalls Industries, and travel reservation system Sabre.",Espionage
A threat actor targeted international sports organizations in Western Europe in the run-up to the International Olympic Committee’s banning Russian athletes from participating in the 2018 Winter Olympics in South Korea.,Espionage
"A threat actor compromises the networks of a contractor for the U.S. Navy, exfiltrating 614 gigabytes of sensitive information, including data related to a new U.S. anti-ship missile and submarine communications systems.",Espionage
"A threat actor targeted U.S. movie theater chain AMC Theatres in 2014 using spear-phishing techniques. The U.S. Department of Justice alleges that the incident was related to the chain's screenings of The Interview, a movie depicting the assassination of North Korean leader Kim Jong-un.",Espionage
"Hackers have infiltrated the EU’s diplomatic communication network for years, using phishing attacks to steal sensitive documents related to trade negotiations and meetings with foreign leaders.",Espionage
"A threat actor targeted financial organizations and bitcoin users, for the purpose of identifying individuals with bitcoin wallets.",Espionage
"A threat actor compromises opposition parties, as well as organizations charged with overseeing the 2018 Cambodian elections, for espionage purposes.",Espionage
"A threat actor, believed to be Russian military intelligence, targeted the office of the Organization for the Prohibition of Chemical Weapons in The Hague with a view of compromising its Wi-Fi network for espionage purposes. Dutch authorities were able to foil the operation, and in a joint press conference with UK officials publicly identified four suspected Russian intelligence officers involved. The United States, Australia, Canada, and New Zealand issued statements denouncing Russia's cyber operations.",Espionage
"This threat actor compromises the networks of companies involved in electric power, specifically looking for intellectual property and information about the companies’ operations.",Espionage
"Austal, a major Australian defense contractor and shipbuilder, was targeted in a data breach. Hackers gained access to ship designs and personnel contact information.",Other
"A threat actor that the U.S. government believes to be sponsored by the Russian government, targets entities in the U.S. energy, nuclear power, water, aviation, and critical manufacturing sectors. According to the Department of Homeland Security, this activity has been ongoing since at least 2014.",Espionage
"A threat actor targeted Mammoth Screen, a UK production company that produced Opposite Number, a television drama set in North Korea.",Espionage
"An attack on the Italian oil firm Saipem targeted servers based in India, Kuwait, Saudi Arabia, Scotland, and the United Arab Emirates. Hackers used a variant of the Shamoon virus.",Espionage
A threat actor targeted consulates and embassies in Eastern Europe for the purpose of espionage.,Espionage
"This threat actor uses social engineering and spear phishing to target military and defense organizations in India, for the purpose of espionage.",Espionage
"A threat actor compromised the U.S. Anti-Doping Agency. Seven of the individuals alleged to be behind this incident, believed to be Russian military intelligence (known as GRU), were indicted by the U.S. Justice Department.",Doxing
"This threat actor targets industrial control systems in Turkey, Europe, and North America.",Espionage
A Russian actor tied to Russia’s Federal Security Service (FSB) targeted Ukrainian government agencies with a backdoor attacker called Pterodo before and during Russia’s seizure of Ukrainian vessels.,Espionage
"A threat actor used a tool, Dark Caracal, to target military personnel, activists, journalists, and lawyers for espionage purposes.",Espionage
A threat actor uses a zero-day vulnerability in Adobe Flash software to compromise a diplomatic target in Qatar.,Espionage
"A threat actor targeted the networks of Lockheed Martin, a U.S. defense contractor. It is one of the developers of the Terminal High Altitude Area Defense (THAAD) system installed in South Korea.",Espionage
The personal information of nearly one thousand North Koreans who defected to South Korea was leaked after unknown hackers gained access to the database of South Korea’s resettlement agency.,Doxing
This threat actor targets nongovernmental organizations using Mongolian-themed lures for espionage purposes.,Espionage
"A threat actor compromised the Court of Arbitration for Sport. Seven of the individuals alleged to be behind this incident, believed to be Russian military intelligence (known as GRU), were indicted by the U.S. Justice Department.",Doxing
"This threat actor, headquartered in Nanjing, China, is a provincial foreign intelligence arm of China's Ministry of State Security. Its activities include domestic counterintelligence, nonmilitary foreign intelligence, and political and domestic security. From at least January 2010, this threat actor has targeted U.S. and European commercial airliners for the purpose of stealing trade secrets. Several intelligence officers have been charged and indicted by the U.S. Department of Justice.",Espionage
